{
  "work_id": "memory-agent-last-visa-0802-en",
  "shot_id": "shot_014_nathan_answers_elena_r2v",
  "prompt": "The video begins exactly on the provided starting frame on the rooftop of the Blue Signal Cafe shortly before dawn. Use one continuous, stable medium close-up for the entire video with no cuts and no camera movement. Nathan is the dark-haired man wearing the white dinner jacket over a black shirt. Elena remains only as the same soft out-of-focus profile at the left edge. Nathan keeps his eyes on Elena and begins speaking immediately. At a brisk, dry, controlled natural pace in his mid-low adult male voice, Nathan says exactly one complete sentence: \"Silence does not explain itself when it arrives.\" Nathan delivers the sentence continuously, completes the final word, then closes his mouth and silently holds Elena's gaze for the rest of the video. Only Nathan speaks, with clear natural English and no invented words before or after the written sentence. Preserve the exact same Nathan and Elena faces, wardrobe, rooftop, framing, harbor background, and pre-dawn lighting from beginning to end. Quiet rooftop and distant harbor ambience accompany Nathan's dialogue. No rain sound, music, on-screen text, labels, signs, cards, graphics, subtitles, or overlays appear.",
  "condition_img": "../assets/images/shot13_nathan_8p6.jpg",
  "memory_slots": [
    {
      "image_url": "../assets/images/shot_001.jpg",
      "audio_url": "../assets/audio/shot_001.wav",
      "metadata": {
        "id": "ID_A",
        "source": "character_memory_full_audio_server_msst",
        "source_shot_id": 1
      }
    },
    {
      "image_url": "../assets/images/last_visa_ID_B_shot7_v2_6p6.jpg",
      "audio_url": "../assets/audio/silence_9p642667.wav",
      "metadata": {
        "id": "ID_B",
        "source": "character_memory_encoded_silence",
        "source_shot_id": 7
      }
    },
    {
      "image_url": "../assets/images/shot13_nathan_8p6.jpg",
      "audio_url": "../assets/audio/silence_9p642667.wav",
      "metadata": {
        "id": "PREVIOUS_SHOT",
        "source": "shot_013_nathan_8p6_encoded_silence",
        "source_shot_id": 13
      }
    }
  ],
  "num_frames": 241,
  "width": 1280,
  "height": 736,
  "seed": 140,
  "duration_sec": 9.6
}
