{
  "work_id": "memory-agent-last-visa-0802-en",
  "shot_id": "shot_057_v1_refugees_cross_southern_bridge_r2v",
  "prompt": "This video has exactly 2 shots. Nobody speaks.\n\nshot1: At first light, a long but orderly line of civilian refugees crosses the southern bridge through pale river mist. Adults carry small suitcases, families guide children, and resistance signal lamps mark the open route. The camera tracks beside them at walking speed.\n\nshot2: Cut to the safe riverbank beyond the bridge. Medical workers guide the arriving families toward waiting relief trucks while the bridge remains visible behind them. A mother embraces her child and the first warm sunlight breaks through the clouds.\n\nRealistic live-action 1940s wartime drama, soft 35mm texture, coherent bridge geography, restrained cinematic camera movement, natural footsteps, cart wheels, river, wind, distant truck engines, and quiet crowd ambience, no intelligible speech, no narration, no subtitles, no direct-to-camera gaze, and no extra scene.",
  "condition_img": null,
  "memory_slots": [],
  "num_frames": 241,
  "width": 1280,
  "height": 736,
  "seed": 1253,
  "duration_sec": 9.6
}
