{
  "work_id": "memory-agent-last-visa-0802-en",
  "shot_id": "shot_054_v2_patrol_misses_hidden_route_seed1237_r2v",
  "prompt": "This video has exactly 2 shots. No named character appears and nobody speaks.\n\nshot1: A 1940s military patrol truck stops at an empty main-road junction near the river. Two officers step down, inspect a false route marker, and direct the truck toward the deserted northern road. They look at the road and each other, never at the camera.\n\nshot2: Cut to the far bank of the hidden southern bridge. The same civilian group with handcarts quietly enters a wooded path while the distant patrol truck passes on another road across the river. The camera follows the civilians until the trees conceal them safely.\n\nRealistic live-action 1940s wartime suspense, soft 35mm texture, coherent river geography and restrained movement, natural truck, boots, carts, leaves, river, and wind sounds only. No speech, no narration, no subtitles, no modern objects, and nobody looks at the camera.",
  "condition_img": null,
  "memory_slots": [],
  "num_frames": 241,
  "width": 1280,
  "height": 736,
  "seed": 1237,
  "duration_sec": 9.6
}
