{
  "work_id": "memory-agent-last-visa-0802-en",
  "shot_id": "shot_050_v2_train_valley_long_interior_r2v",
  "prompt": "This video has exactly 2 shots. No named character appears.\n\nshot1: Begin immediately inside a 1940s passenger carriage. Hold this shot for most of the video. A mother sits beside her young child while a bright green mountain valley moves steadily past the large window behind them. The mother looks only at the child and immediately says, \"We're across the border. You can sleep now.\" She completes the full sentence, closes her mouth, and gently holds the child close. Other refugees remain quiet and nobody looks at the camera.\n\nshot2: Cut to a wide exterior view of the same dark green train already deep inside the broad sunlit mountain valley. The train follows a curved track beside a river and continues away between the mountains.\n\nRealistic live-action 1940s wartime drama, soft 35mm texture, stable carriage and passengers, clear synchronized English speech from the mother only, natural train wheels, carriage vibration, fabric, river, and valley ambience, no extra speech, no narration, no subtitles, and nobody looks at the camera.",
  "condition_img": null,
  "memory_slots": [],
  "num_frames": 241,
  "width": 1280,
  "height": 736,
  "seed": 1197,
  "duration_sec": 9.6
}
