{
  "work_id": "memory-agent-last-visa-0802-en",
  "shot_id": "shot_046_v2_evacuation_network_signal_seed1151_r2v",
  "prompt": "This video has exactly 3 shots. No named character appears and nobody speaks.\n\nshot1: In a dim city basement, a hidden 1940s tabletop radio blinks beside a folded route map. A mother and her teenage son listen, exchange one relieved look, and close a small travel bag.\n\nshot2: Cut to a railway workshop. Two workers hear the same signal from a field radio, look toward each other rather than the camera, and move a route marker from a blocked road to the northern bridge.\n\nshot3: Cut to a rural safe house in morning light. A small group of refugees quietly leaves through the rear door carrying modest bags while one guide checks the empty road ahead. Everyone moves naturally away from the building.\n\nRealistic live-action 1940s wartime drama, soft 35mm texture, clear visual continuity through the repeating radio signal, natural radio static, fabric, footsteps, and morning ambience only. Every person's gaze stays on a companion, the doorway, or the road. No speech, no narration, no subtitles, no modern objects, and nobody looks at the camera.",
  "condition_img": null,
  "memory_slots": [],
  "num_frames": 241,
  "width": 1280,
  "height": 736,
  "seed": 1151,
  "duration_sec": 9.6
}
