{
  "work_id": "memory-agent-last-visa-0802-en",
  "shot_id": "shot_037_v2_nathan_rusk_mutual_dialogue_seed1031_r2v",
  "prompt": "ID_A is Nathan, a lean man with dark wavy side-parted hair, a long angular face, pronounced cheekbones, and gray-blue eyes. He wears a white dinner jacket over a black shirt.\n\nID_D is Major Rusk, a stern middle-aged military officer with a broad weathered face and short dark hair. He wears a dark green wartime military uniform.\n\nThis video has exactly 1 shot.\n\nInside the reopened Blue Signal Cafe in pale morning light, ID_A and ID_D stand on opposite sides of the radio desk in one stable medium two-shot. Their bodies are shown in three-quarter profile. They face each other directly and maintain natural eye contact with each other throughout the conversation. Neither man ever faces or looks toward the camera.\n\nID_D looks only at ID_A and promptly says, \"The ships will hear you.\" He completes the sentence and closes his mouth. ID_A keeps looking only at ID_D and immediately replies, \"Then we keep transmitting until the harbor is empty.\" He completes the sentence and closes his mouth. ID_D gives one restrained nod. Both men remain silent afterward while the transmitter operates beside them.\n\nRealistic live-action 1940s wartime thriller cinematography, restrained soft 35mm texture, stable distinct identities, correct mutual eyelines, clear synchronized speech, exactly two men, no duplicate person, no narration, no subtitles, no additional dialogue, and absolutely no direct-to-camera gaze.",
  "condition_img": null,
  "memory_slots": [
    {
      "image_url": "../assets/images/last_visa_id_a_current_shot4_v11_7p5.jpg",
      "audio_url": "../assets/audio/shot_001.wav",
      "metadata": {
        "id": "ID_A",
        "source": "character_image_full_voice",
        "source_shot_id": 4
      }
    },
    {
      "image_url": "../assets/images/last_visa_id_d_rusk_shot25_3p0.jpg",
      "audio_url": "../assets/audio/last_visa_ID_D_voice_shot5.wav",
      "metadata": {
        "id": "ID_D",
        "source": "character_image_full_voice",
        "source_shot_id": 25
      }
    }
  ],
  "num_frames": 241,
  "width": 1280,
  "height": 736,
  "seed": 1031,
  "duration_sec": 9.6
}
